<?xml version="1.0" encoding="UTF-8"?>
<?xml-stylesheet href="bookshelf.css" type="text/css" ?>

<bookshelf 
  xmlns:xsi="http://www.w3.org/2001/XMLSchema-instance"
	xmlns="urn:test.Namespace"
	xsi:schemaLocation="urn:test.Namespace bookshelf.xsd">
	<information>
		<description>Zbiór książek w sklepie.</description>
		<authors>
			<author>
				<name>Adrian</name>
				<surname>Granosik</surname>
				<indeks>210194</indeks>
			</author>
			<author>
				<name>Izabela</name>
				<surname>Sobczyk</surname>
				<indeks>210319</indeks>
			</author>
		</authors>
		<modification_date>2019-03-14</modification_date>
	</information>

</bookshelf>